{
  "schemaVersion": 1,
  "contractId": "nll/original-client-compatibility-gate/v1",
  "assessmentUid": "30000000-0000-0000-0000-000000000001",
  "assessedAtUtc": "2026-08-20T00:00:00Z",
  "verdict": "blocked_insufficient_evidence",
  "route": {
    "kind": "unresolved",
    "authorizationStatus": "not_verified",
    "scopeStatus": "not_verified",
    "authorizationEvidence": null,
    "selectorInterfaceCode": null,
    "selectorEvidence": null,
    "allowedPurposeCode": null
  },
  "clientBuild": {
    "bindingStatus": "unbound",
    "buildUid": null,
    "executableObservation": null,
    "contentSet": null,
    "adapterContractId": null
  },
  "handshakeContract": {
    "status": "not_verified",
    "contractId": null,
    "evidence": null
  },
  "sessionBoundary": {
    "status": "not_evaluated",
    "syntheticLocalSessionOnly": false,
    "officialCredentialsUsed": false,
    "officialSessionMaterialUsed": false,
    "evidence": null
  },
  "outboundIsolation": {
    "status": "not_evaluated",
    "processTreeScopeStatus": "not_defined",
    "coversIpv4": false,
    "coversIpv6": false,
    "coversDns": false,
    "coversTcp": false,
    "coversUdp": false,
    "evidence": null
  },
  "prohibitedTechniques": {
    "endpointOrAuthMutation": false,
    "officialProtocolReplay": false,
    "guessedCredentials": false,
    "processInjection": false,
    "hooking": false,
    "memoryPatch": false,
    "launcherBypass": false,
    "antiCheatBypass": false
  },
  "repositoryBoundary": {
    "evidenceLocationPolicy": "local_runtime_only",
    "originalArtifactsCommitted": false,
    "decryptedArtifactsCommitted": false,
    "patchOutputsCommitted": false,
    "wireCapturesCommitted": false,
    "clientLocalReferencesExposed": false
  },
  "unresolvedReasonCodes": [
    "approved_route_evidence_missing",
    "exact_client_build_binding_missing",
    "outbound_isolation_plan_missing",
    "supported_handshake_contract_evidence_missing",
    "synthetic_session_enforcement_plan_missing"
  ]
}
